1;4;1;Первый космонавт Земли?;1)Нил Армстронг;2)Алексей Леонов;3)Валентина Терешкова ;4)Юрий Гагарин
2;3;2;Кто открыл Америку?;1)Ломоносов Михайло;2)Пушкин Александр;3)Колумб Христофор ;4)Америго Веспуччи
3;3;3;Самое глубокое озеро Земли?;1)Матано;2)Крейтер;3)Байкал;4)Иссык-Куль
4;4;4;Сколько гласных букв в английсом алфавите?;1)6;2)7;3)4;4)5
5;1;5;Где живет Дед Мороз?;1)В Великом Устюге;2)В Великом утюге;3)У Снежной Королевы;4)В соседней квартире
6;2;6;Как зовут Деда Мороза в Греции?;1)Сильвестр;2)Святой Василий;3)Дед Жар;4)Дед Карачун
